{
  "office": "usa.president",
  "units_label": "State",
  "majority": "absolute",
  "note": "Electoral votes per state are House seats plus two (Washington, D.C. has three under the Twenty-third Amendment). Apportionments take effect for elections from the listed year: 1990 census from 1993, 2000 census from 2003, 2010 census from 2013, 2020 census from 2023. basis_shares are the Republican and Democratic shares of each state's popular vote in the 2000 presidential election; the game derives each state's lean from them. If no candidate wins an absolute majority of electoral votes, the game falls back to the candidate with the most electoral votes (the real contingent election in the House is not modelled).",
  "basis_election": "president_2000",
  "units": [
    {
      "id": "AL",
      "name": "Alabama",
      "adm1": [
        "USA-3541"
      ],
      "votes": [
        {
          "from_year": 1993,
          "votes": 9
        },
        {
          "from_year": 2003,
          "votes": 9
        },
        {
          "from_year": 2013,
          "votes": 9
        },
        {
          "from_year": 2023,
          "votes": 9
        }
      ],
      "basis_shares": {
        "usa.republican": 0.5648,
        "usa.democratic": 0.4157
      }
    },
    {
      "id": "AK",
      "name": "Alaska",
      "adm1": [
        "USA-3563"
      ],
      "votes": [
        {
          "from_year": 1993,
          "votes": 3
        },
        {
          "from_year": 2003,
          "votes": 3
        },
        {
          "from_year": 2013,
          "votes": 3
        },
        {
          "from_year": 2023,
          "votes": 3
        }
      ],
      "basis_shares": {
        "usa.republican": 0.5862,
        "usa.democratic": 0.2767
      }
    },
    {
      "id": "AZ",
      "name": "Arizona",
      "adm1": [
        "USA-3520"
      ],
      "votes": [
        {
          "from_year": 1993,
          "votes": 8
        },
        {
          "from_year": 2003,
          "votes": 10
        },
        {
          "from_year": 2013,
          "votes": 11
        },
        {
          "from_year": 2023,
          "votes": 11
        }
      ],
      "basis_shares": {
        "usa.republican": 0.5102,
        "usa.democratic": 0.4473
      }
    },
    {
      "id": "AR",
      "name": "Arkansas",
      "adm1": [
        "USA-3528"
      ],
      "votes": [
        {
          "from_year": 1993,
          "votes": 6
        },
        {
          "from_year": 2003,
          "votes": 6
        },
        {
          "from_year": 2013,
          "votes": 6
        },
        {
          "from_year": 2023,
          "votes": 6
        }
      ],
      "basis_shares": {
        "usa.republican": 0.5131,
        "usa.democratic": 0.4586
      }
    },
    {
      "id": "CA",
      "name": "California",
      "adm1": [
        "USA-3521"
      ],
      "votes": [
        {
          "from_year": 1993,
          "votes": 54
        },
        {
          "from_year": 2003,
          "votes": 55
        },
        {
          "from_year": 2013,
          "votes": 55
        },
        {
          "from_year": 2023,
          "votes": 54
        }
      ],
      "basis_shares": {
        "usa.republican": 0.4165,
        "usa.democratic": 0.5345
      }
    },
    {
      "id": "CO",
      "name": "Colorado",
      "adm1": [
        "USA-3522"
      ],
      "votes": [
        {
          "from_year": 1993,
          "votes": 8
        },
        {
          "from_year": 2003,
          "votes": 9
        },
        {
          "from_year": 2013,
          "votes": 9
        },
        {
          "from_year": 2023,
          "votes": 10
        }
      ],
      "basis_shares": {
        "usa.republican": 0.5075,
        "usa.democratic": 0.4239
      }
    },
    {
      "id": "CT",
      "name": "Connecticut",
      "adm1": [
        "USA-3537"
      ],
      "votes": [
        {
          "from_year": 1993,
          "votes": 8
        },
        {
          "from_year": 2003,
          "votes": 7
        },
        {
          "from_year": 2013,
          "votes": 7
        },
        {
          "from_year": 2023,
          "votes": 7
        }
      ],
      "basis_shares": {
        "usa.republican": 0.3844,
        "usa.democratic": 0.5591
      }
    },
    {
      "id": "DE",
      "name": "Delaware",
      "adm1": [
        "USA-3555"
      ],
      "votes": [
        {
          "from_year": 1993,
          "votes": 3
        },
        {
          "from_year": 2003,
          "votes": 3
        },
        {
          "from_year": 2013,
          "votes": 3
        },
        {
          "from_year": 2023,
          "votes": 3
        }
      ],
      "basis_shares": {
        "usa.republican": 0.419,
        "usa.democratic": 0.5496
      }
    },
    {
      "id": "DC",
      "name": "District of Columbia",
      "adm1": [
        "USA-3556"
      ],
      "votes": [
        {
          "from_year": 1993,
          "votes": 3
        },
        {
          "from_year": 2003,
          "votes": 3
        },
        {
          "from_year": 2013,
          "votes": 3
        },
        {
          "from_year": 2023,
          "votes": 3
        }
      ],
      "basis_shares": {
        "usa.republican": 0.0895,
        "usa.democratic": 0.8516
      }
    },
    {
      "id": "FL",
      "name": "Florida",
      "adm1": [
        "USA-3542"
      ],
      "votes": [
        {
          "from_year": 1993,
          "votes": 25
        },
        {
          "from_year": 2003,
          "votes": 27
        },
        {
          "from_year": 2013,
          "votes": 29
        },
        {
          "from_year": 2023,
          "votes": 30
        }
      ],
      "basis_shares": {
        "usa.republican": 0.4885,
        "usa.democratic": 0.4884
      }
    },
    {
      "id": "GA",
      "name": "Georgia",
      "adm1": [
        "USA-3543"
      ],
      "votes": [
        {
          "from_year": 1993,
          "votes": 13
        },
        {
          "from_year": 2003,
          "votes": 15
        },
        {
          "from_year": 2013,
          "votes": 16
        },
        {
          "from_year": 2023,
          "votes": 16
        }
      ],
      "basis_shares": {
        "usa.republican": 0.5467,
        "usa.democratic": 0.4298
      }
    },
    {
      "id": "HI",
      "name": "Hawaii",
      "adm1": [
        "USA-3517"
      ],
      "votes": [
        {
          "from_year": 1993,
          "votes": 4
        },
        {
          "from_year": 2003,
          "votes": 4
        },
        {
          "from_year": 2013,
          "votes": 4
        },
        {
          "from_year": 2023,
          "votes": 4
        }
      ],
      "basis_shares": {
        "usa.republican": 0.3746,
        "usa.democratic": 0.5579
      }
    },
    {
      "id": "ID",
      "name": "Idaho",
      "adm1": [
        "USA-3518"
      ],
      "votes": [
        {
          "from_year": 1993,
          "votes": 4
        },
        {
          "from_year": 2003,
          "votes": 4
        },
        {
          "from_year": 2013,
          "votes": 4
        },
        {
          "from_year": 2023,
          "votes": 4
        }
      ],
      "basis_shares": {
        "usa.republican": 0.6717,
        "usa.democratic": 0.2764
      }
    },
    {
      "id": "IL",
      "name": "Illinois",
      "adm1": [
        "USA-3546"
      ],
      "votes": [
        {
          "from_year": 1993,
          "votes": 22
        },
        {
          "from_year": 2003,
          "votes": 21
        },
        {
          "from_year": 2013,
          "votes": 20
        },
        {
          "from_year": 2023,
          "votes": 19
        }
      ],
      "basis_shares": {
        "usa.republican": 0.4258,
        "usa.democratic": 0.546
      }
    },
    {
      "id": "IN",
      "name": "Indiana",
      "adm1": [
        "USA-3547"
      ],
      "votes": [
        {
          "from_year": 1993,
          "votes": 12
        },
        {
          "from_year": 2003,
          "votes": 11
        },
        {
          "from_year": 2013,
          "votes": 11
        },
        {
          "from_year": 2023,
          "votes": 11
        }
      ],
      "basis_shares": {
        "usa.republican": 0.5665,
        "usa.democratic": 0.4101
      }
    },
    {
      "id": "IA",
      "name": "Iowa",
      "adm1": [
        "USA-3529"
      ],
      "votes": [
        {
          "from_year": 1993,
          "votes": 7
        },
        {
          "from_year": 2003,
          "votes": 7
        },
        {
          "from_year": 2013,
          "votes": 6
        },
        {
          "from_year": 2023,
          "votes": 6
        }
      ],
      "basis_shares": {
        "usa.republican": 0.4822,
        "usa.democratic": 0.4854
      }
    },
    {
      "id": "KS",
      "name": "Kansas",
      "adm1": [
        "USA-3530"
      ],
      "votes": [
        {
          "from_year": 1993,
          "votes": 6
        },
        {
          "from_year": 2003,
          "votes": 6
        },
        {
          "from_year": 2013,
          "votes": 6
        },
        {
          "from_year": 2023,
          "votes": 6
        }
      ],
      "basis_shares": {
        "usa.republican": 0.5804,
        "usa.democratic": 0.3724
      }
    },
    {
      "id": "KY",
      "name": "Kentucky",
      "adm1": [
        "USA-3548"
      ],
      "votes": [
        {
          "from_year": 1993,
          "votes": 8
        },
        {
          "from_year": 2003,
          "votes": 8
        },
        {
          "from_year": 2013,
          "votes": 8
        },
        {
          "from_year": 2023,
          "votes": 8
        }
      ],
      "basis_shares": {
        "usa.republican": 0.565,
        "usa.democratic": 0.4137
      }
    },
    {
      "id": "LA",